{
  "$schema": "http://json-schema.org/draft-07/schema#",
  "title": "Agent Screen v1",
  "type": "object",
  "properties": {
    "schema_version": {
      "const": 1
    },
    "heading": {
      "type": "string",
      "minLength": 1,
      "maxLength": 44
    },
    "updated_at": {
      "type": "string",
      "minLength": 1,
      "maxLength": 32
    },
    "blocks": {
      "type": "array",
      "minItems": 1,
      "maxItems": 4,
      "items": {
        "oneOf": [
          {
            "type": "object",
            "properties": {
              "type": {
                "const": "brief"
              },
              "width": {
                "enum": [
                  "half",
                  "full"
                ]
              },
              "emphasis": {
                "enum": [
                  "normal",
                  "important"
                ]
              },
              "title": {
                "type": "string",
                "minLength": 1,
                "maxLength": 32
              },
              "text": {
                "type": "string",
                "minLength": 1,
                "maxLength": 180
              }
            },
            "required": [
              "type",
              "width",
              "title",
              "text"
            ],
            "additionalProperties": false
          },
          {
            "type": "object",
            "properties": {
              "type": {
                "const": "metric"
              },
              "width": {
                "enum": [
                  "half",
                  "full"
                ]
              },
              "emphasis": {
                "enum": [
                  "normal",
                  "important"
                ]
              },
              "title": {
                "type": "string",
                "minLength": 1,
                "maxLength": 32
              },
              "value": {
                "type": "string",
                "minLength": 1,
                "maxLength": 12
              },
              "text": {
                "type": "string",
                "minLength": 1,
                "maxLength": 64
              }
            },
            "required": [
              "type",
              "width",
              "title",
              "value",
              "text"
            ],
            "additionalProperties": false
          },
          {
            "type": "object",
            "properties": {
              "type": {
                "const": "list"
              },
              "width": {
                "enum": [
                  "half",
                  "full"
                ]
              },
              "emphasis": {
                "enum": [
                  "normal",
                  "important"
                ]
              },
              "title": {
                "type": "string",
                "minLength": 1,
                "maxLength": 32
              },
              "items": {
                "type": "array",
                "minItems": 1,
                "maxItems": 3,
                "items": {
                  "type": "string",
                  "minLength": 1,
                  "maxLength": 48
                }
              }
            },
            "required": [
              "type",
              "width",
              "title",
              "items"
            ],
            "additionalProperties": false
          },
          {
            "type": "object",
            "properties": {
              "type": {
                "const": "agenda"
              },
              "width": {
                "enum": [
                  "half",
                  "full"
                ]
              },
              "emphasis": {
                "enum": [
                  "normal",
                  "important"
                ]
              },
              "title": {
                "type": "string",
                "minLength": 1,
                "maxLength": 32
              },
              "items": {
                "type": "array",
                "minItems": 1,
                "maxItems": 3,
                "items": {
                  "type": "object",
                  "properties": {
                    "time": {
                      "type": "string",
                      "minLength": 1,
                      "maxLength": 8
                    },
                    "text": {
                      "type": "string",
                      "minLength": 1,
                      "maxLength": 38
                    }
                  },
                  "required": [
                    "time",
                    "text"
                  ],
                  "additionalProperties": false
                }
              }
            },
            "required": [
              "type",
              "width",
              "title",
              "items"
            ],
            "additionalProperties": false
          },
          {
            "type": "object",
            "properties": {
              "type": {
                "const": "table"
              },
              "width": {
                "enum": [
                  "half",
                  "full"
                ]
              },
              "emphasis": {
                "enum": [
                  "normal",
                  "important"
                ]
              },
              "title": {
                "type": "string",
                "minLength": 1,
                "maxLength": 32
              },
              "headers": {
                "type": "array",
                "minItems": 2,
                "maxItems": 3,
                "items": {
                  "type": "string",
                  "minLength": 1,
                  "maxLength": 18
                }
              },
              "rows": {
                "type": "array",
                "minItems": 1,
                "maxItems": 3,
                "items": {
                  "type": "array",
                  "minItems": 2,
                  "maxItems": 3,
                  "items": {
                    "type": "string",
                    "minLength": 1,
                    "maxLength": 24
                  }
                }
              }
            },
            "required": [
              "type",
              "width",
              "title",
              "headers",
              "rows"
            ],
            "additionalProperties": false
          }
        ]
      }
    }
  },
  "required": [
    "schema_version",
    "heading",
    "updated_at",
    "blocks"
  ],
  "additionalProperties": false
}
