{
  "schema_version": 1,
  "heading": "Your morning briefing",
  "updated_at": "Demo · Oct 27, 2026",
  "blocks": [
    {
      "type": "brief",
      "width": "full",
      "emphasis": "important",
      "title": "Keep the morning clear",
      "text": "Your meetings start after lunch. Use the morning for focused work, then leave a little breathing room before the afternoon."
    },
    {
      "type": "metric",
      "width": "half",
      "title": "Next meeting",
      "value": "13:00",
      "text": "Product review"
    },
    {
      "type": "list",
      "width": "half",
      "title": "Priorities",
      "items": [
        "Finish proposal",
        "Review release",
        "Take a walk"
      ]
    }
  ]
}
