{
  "schema_version": 1,
  "heading": "The afternoon ahead",
  "updated_at": "Demo · Oct 27, 2026",
  "blocks": [
    {
      "type": "agenda",
      "width": "half",
      "title": "Schedule",
      "items": [
        {
          "time": "13:00",
          "text": "Product review"
        },
        {
          "time": "14:30",
          "text": "Design feedback"
        },
        {
          "time": "16:00",
          "text": "Wrap up and plan tomorrow"
        }
      ]
    },
    {
      "type": "table",
      "width": "half",
      "title": "Project pulse",
      "headers": [
        "Project",
        "Status"
      ],
      "rows": [
        [
          "Proposal",
          "Draft ready"
        ],
        [
          "Release",
          "In review"
        ],
        [
          "Research",
          "Next week"
        ]
      ]
    },
    {
      "type": "brief",
      "width": "full",
      "title": "A little room to breathe",
      "text": "Keep the final hour flexible. Close the small loops before taking on anything new."
    }
  ]
}
