{
  "schema_version": 1,
  "heading": "At a glance",
  "updated_at": "Demo · Oct 27, 2026",
  "blocks": [
    {
      "type": "metric",
      "width": "half",
      "title": "Focus time",
      "value": "3h",
      "text": "Protect the morning"
    },
    {
      "type": "metric",
      "width": "half",
      "title": "Next meeting",
      "value": "13:00",
      "text": "Product review"
    },
    {
      "type": "metric",
      "width": "half",
      "title": "Open priorities",
      "value": "3",
      "text": "One at a time"
    },
    {
      "type": "metric",
      "width": "half",
      "title": "Daily progress",
      "value": "75%",
      "text": "Steady progress"
    }
  ]
}
